{
  "schema_version": 1,
  "generated_from": [
    "data/tools.json",
    "data/workflows.json"
  ],
  "contract_scope": "public-catalog-only",
  "main_site": {
    "origin": "https://modiqi.com",
    "role": "acquisition-content-and-service-conversion"
  },
  "toolbox": {
    "runtime_origin": null,
    "role": "independent-local-first-application"
  },
  "tools": [
    {
      "tool_id": "ai-toolkit:ai-agent-card",
      "title": "AI 智能体工牌 (AI Agent ID Card)",
      "module": "ai",
      "tier": "library",
      "tool_path": "ai-toolkit/ai-agent-card.html",
      "workflow_ids": [],
      "resource_level": "directory",
      "main_site_path": "/tools/ai/ai-agent-card/",
      "publication_status": "planned",
      "review_status": "unreviewed"
    },
    {
      "tool_id": "ai-toolkit:ai-opportunity-radar",
      "title": "AI 机会雷达 (AI Opportunity Radar)",
      "module": "ai",
      "tier": "library",
      "tool_path": "ai-toolkit/ai-opportunity-radar.html",
      "workflow_ids": [],
      "resource_level": "directory",
      "main_site_path": "/tools/ai/ai-opportunity-radar/",
      "publication_status": "planned",
      "review_status": "unreviewed"
    },
    {
      "tool_id": "ai-toolkit:ai-persona-generator",
      "title": "AI 用户画像生成器 (AI Persona Generator)",
      "module": "ai",
      "tier": "library",
      "tool_path": "ai-toolkit/ai-persona-generator.html",
      "workflow_ids": [],
      "resource_level": "directory",
      "main_site_path": "/tools/ai/ai-persona-generator/",
      "publication_status": "planned",
      "review_status": "unreviewed"
    },
    {
      "tool_id": "ai-toolkit:ai-tool-matrix",
      "title": "AI 工具选型矩阵 (AI Tool Selection Matrix)",
      "module": "ai",
      "tier": "library",
      "tool_path": "ai-toolkit/ai-tool-matrix.html",
      "workflow_ids": [],
      "resource_level": "directory",
      "main_site_path": "/tools/ai/ai-tool-matrix/",
      "publication_status": "planned",
      "review_status": "unreviewed"
    },
    {
      "tool_id": "ai-toolkit:ai-workflow-builder",
      "title": "AI 工作流构建器 (AI Workflow Builder)",
      "module": "ai",
      "tier": "library",
      "tool_path": "ai-toolkit/ai-workflow-builder.html",
      "workflow_ids": [],
      "resource_level": "directory",
      "main_site_path": "/tools/ai/ai-workflow-builder/",
      "publication_status": "planned",
      "review_status": "unreviewed"
    },
    {
      "tool_id": "ai-toolkit:content-repurposing-engine",
      "title": "内容复用引擎 (Content Repurposing Engine)",
      "module": "ai",
      "tier": "library",
      "tool_path": "ai-toolkit/content-repurposing-engine.html",
      "workflow_ids": [],
      "resource_level": "directory",
      "main_site_path": "/tools/ai/content-repurposing-engine/",
      "publication_status": "planned",
      "review_status": "unreviewed"
    },
    {
      "tool_id": "ai-toolkit:prompt-canvas",
      "title": "AI 提示词工程画布 (Prompt Engineering Canvas)",
      "module": "ai",
      "tier": "library",
      "tool_path": "ai-toolkit/prompt-canvas.html",
      "workflow_ids": [],
      "resource_level": "directory",
      "main_site_path": "/tools/ai/prompt-canvas/",
      "publication_status": "planned",
      "review_status": "unreviewed"
    },
    {
      "tool_id": "analytics-toolkit:ab-test-planner",
      "title": "A/B 测试规划器 (A/B Test Planner)",
      "module": "analytics",
      "tier": "core",
      "tool_path": "analytics-toolkit/ab-test-planner.html",
      "workflow_ids": [
        "measurement-growth"
      ],
      "resource_level": "authoritative",
      "main_site_path": "/tools/analytics/ab-test-planner/",
      "publication_status": "planned",
      "review_status": "unreviewed"
    },
    {
      "tool_id": "analytics-toolkit:attribution-model",
      "title": "归因模型分析器 (Attribution Modeler)",
      "module": "analytics",
      "tier": "library",
      "tool_path": "analytics-toolkit/attribution-model.html",
      "workflow_ids": [],
      "resource_level": "directory",
      "main_site_path": "/tools/analytics/attribution-model/",
      "publication_status": "planned",
      "review_status": "unreviewed"
    },
    {
      "tool_id": "analytics-toolkit:budget-allocator",
      "title": "营销预算分配器 (Marketing Budget Allocator)",
      "module": "analytics",
      "tier": "library",
      "tool_path": "analytics-toolkit/budget-allocator.html",
      "workflow_ids": [],
      "resource_level": "directory",
      "main_site_path": "/tools/analytics/budget-allocator/",
      "publication_status": "planned",
      "review_status": "unreviewed"
    },
    {
      "tool_id": "analytics-toolkit:budget-planner",
      "title": "营销预算规划器 (Marketing Budget Planner)",
      "module": "analytics",
      "tier": "library",
      "tool_path": "analytics-toolkit/budget-planner.html",
      "workflow_ids": [],
      "resource_level": "directory",
      "main_site_path": "/tools/analytics/budget-planner/",
      "publication_status": "planned",
      "review_status": "unreviewed"
    },
    {
      "tool_id": "analytics-toolkit:clv-calculator",
      "title": "CLV 计算器 (Customer Lifetime Value Calculator)",
      "module": "analytics",
      "tier": "library",
      "tool_path": "analytics-toolkit/clv-calculator.html",
      "workflow_ids": [],
      "resource_level": "directory",
      "main_site_path": "/tools/analytics/clv-calculator/",
      "publication_status": "planned",
      "review_status": "unreviewed"
    },
    {
      "tool_id": "analytics-toolkit:cohort-analysis",
      "title": "队列分析表 (Cohort Analysis)",
      "module": "analytics",
      "tier": "library",
      "tool_path": "analytics-toolkit/cohort-analysis.html",
      "workflow_ids": [],
      "resource_level": "directory",
      "main_site_path": "/tools/analytics/cohort-analysis/",
      "publication_status": "planned",
      "review_status": "unreviewed"
    },
    {
      "tool_id": "analytics-toolkit:competitor-analysis",
      "title": "竞争对手分析 (Competitor Analysis)",
      "module": "analytics",
      "tier": "library",
      "tool_path": "analytics-toolkit/competitor-analysis.html",
      "workflow_ids": [],
      "resource_level": "directory",
      "main_site_path": "/tools/analytics/competitor-analysis/",
      "publication_status": "planned",
      "review_status": "unreviewed"
    },
    {
      "tool_id": "analytics-toolkit:experiment-board",
      "title": "增长实验看板 (Growth Experiment Board)",
      "module": "analytics",
      "tier": "library",
      "tool_path": "analytics-toolkit/experiment-board.html",
      "workflow_ids": [],
      "resource_level": "directory",
      "main_site_path": "/tools/analytics/experiment-board/",
      "publication_status": "planned",
      "review_status": "unreviewed"
    },
    {
      "tool_id": "analytics-toolkit:funnel-diagnosis",
      "title": "漏斗诊断卡 (Funnel Diagnosis)",
      "module": "analytics",
      "tier": "core",
      "tool_path": "analytics-toolkit/funnel-diagnosis.html",
      "workflow_ids": [
        "measurement-growth"
      ],
      "resource_level": "authoritative",
      "main_site_path": "/tools/analytics/funnel-diagnosis/",
      "publication_status": "planned",
      "review_status": "unreviewed"
    },
    {
      "tool_id": "analytics-toolkit:ice-scoring",
      "title": "ICE 评分矩阵 (ICE Scoring Matrix)",
      "module": "analytics",
      "tier": "library",
      "tool_path": "analytics-toolkit/ice-scoring.html",
      "workflow_ids": [],
      "resource_level": "directory",
      "main_site_path": "/tools/analytics/ice-scoring/",
      "publication_status": "planned",
      "review_status": "unreviewed"
    },
    {
      "tool_id": "analytics-toolkit:kpi-dashboard",
      "title": "KPI 仪表盘 (KPI Dashboard)",
      "module": "analytics",
      "tier": "core",
      "tool_path": "analytics-toolkit/kpi-dashboard.html",
      "workflow_ids": [
        "measurement-growth"
      ],
      "resource_level": "authoritative",
      "main_site_path": "/tools/analytics/kpi-dashboard/",
      "publication_status": "planned",
      "review_status": "unreviewed"
    },
    {
      "tool_id": "analytics-toolkit:measurement-plan",
      "title": "数字营销评估计划 (Measurement Plan)",
      "module": "analytics",
      "tier": "core",
      "tool_path": "analytics-toolkit/measurement-plan.html",
      "workflow_ids": [
        "measurement-growth"
      ],
      "resource_level": "authoritative",
      "main_site_path": "/tools/analytics/measurement-plan/",
      "publication_status": "planned",
      "review_status": "unreviewed"
    },
    {
      "tool_id": "analytics-toolkit:north-star-metric",
      "title": "北极星指标 (North Star Metric)",
      "module": "analytics",
      "tier": "library",
      "tool_path": "analytics-toolkit/north-star-metric.html",
      "workflow_ids": [],
      "resource_level": "directory",
      "main_site_path": "/tools/analytics/north-star-metric/",
      "publication_status": "planned",
      "review_status": "unreviewed"
    },
    {
      "tool_id": "analytics-toolkit:pirate-metrics",
      "title": "海盗指标 AARRR - Modiqi Analytics Workbench",
      "module": "analytics",
      "tier": "library",
      "tool_path": "analytics-toolkit/pirate-metrics.html",
      "workflow_ids": [],
      "resource_level": "directory",
      "main_site_path": "/tools/analytics/pirate-metrics/",
      "publication_status": "planned",
      "review_status": "unreviewed"
    },
    {
      "tool_id": "analytics-toolkit:rfm-analysis",
      "title": "RFM 模型分析 (RFM Analysis)",
      "module": "analytics",
      "tier": "library",
      "tool_path": "analytics-toolkit/rfm-analysis.html",
      "workflow_ids": [],
      "resource_level": "directory",
      "main_site_path": "/tools/analytics/rfm-analysis/",
      "publication_status": "planned",
      "review_status": "unreviewed"
    },
    {
      "tool_id": "analytics-toolkit:roi-calculator",
      "title": "ROI 计算器 (Marketing ROI Calculator)",
      "module": "analytics",